{
  "$schema": "http://json-schema.org/draft-07/schema#",
  "$id": "https://github.com/rjmurillo/ai-agents/schemas/session-log.schema.json",
  "title": "AI Agents Session Log",
  "description": "JSON schema for AI agent session logs tracking work, decisions, and protocol compliance",
  "type": "object",
  "required": [
    "schemaVersion",
    "session",
    "protocolCompliance",
    "workLog",
    "endingCommit",
    "nextSteps"
  ],
  "properties": {
    "schemaVersion": {
      "type": "string",
      "description": "Schema version for future migration compatibility (required for new sessions)",
      "pattern": "^[0-9]+\\.[0-9]+$",
      "examples": ["1.0"]
    },
    "session": {
      "type": "object",
      "description": "Session metadata",
      "required": ["number", "date", "branch", "startingCommit", "objective"],
      "properties": {
        "number": {
          "type": "integer",
          "description": "Sequential session number",
          "minimum": 1
        },
        "date": {
          "type": "string",
          "description": "Session date",
          "pattern": "^[0-9]{4}-[0-9]{2}-[0-9]{2}$",
          "examples": ["2026-01-09"]
        },
        "branch": {
          "type": "string",
          "description": "Git branch name (empty string allowed for detached HEAD or unknown state)"
        },
        "startingCommit": {
          "type": "string",
          "description": "Git commit SHA at session start (short or full, empty allowed for unknown state)",
          "pattern": "^([0-9a-f]{7,40})?$"
        },
        "objective": {
          "type": "string",
          "description": "Session goal or purpose",
          "minLength": 1
        },
        "traceId": {
          "type": "string",
          "description": "Trace correlation ID (UUID) linking this session to a multi-agent execution graph. Generated by the orchestrator and propagated to all spawned sub-agents.",
          "pattern": "^[0-9a-f]{8}-[0-9a-f]{4}-[0-9a-f]{4}-[0-9a-f]{4}-[0-9a-f]{12}$"
        },
        "parentSessionId": {
          "type": "string",
          "description": "Session identifier of the parent agent that spawned this session, enabling call graph reconstruction. Format: YYYY-MM-DD-session-N.",
          "pattern": "^[0-9]{4}-[0-9]{2}-[0-9]{2}-session-[0-9]+$"
        }
      }
    },
    "protocolCompliance": {
      "type": "object",
      "description": "Session protocol checklist status",
      "required": ["sessionStart", "sessionEnd"],
      "properties": {
        "sessionStart": {
          "type": "object",
          "description": "Start checklist items",
          "patternProperties": {
            "^[a-zA-Z]+$": {
              "$ref": "#/definitions/checklistItem"
            }
          }
        },
        "sessionEnd": {
          "type": "object",
          "description": "End checklist items",
          "patternProperties": {
            "^[a-zA-Z]+$": {
              "$ref": "#/definitions/checklistItem"
            }
          }
        }
      }
    },
    "workLog": {
      "type": "array",
      "description": "Session activities and outcomes (flexible: simple entries, structured outcomes, or free-form)",
      "items": {
        "type": "object"
      }
    },
    "outcomes": {
      "type": "object",
      "description": "Optional structured outcomes (alternative to workLog)",
      "properties": {
        "deliverables": {
          "type": "array",
          "items": {
            "$ref": "#/definitions/deliverable"
          }
        },
        "memoriesObsoleted": {
          "type": "array",
          "items": {
            "type": "object",
            "properties": {
              "id": {"type": "integer"},
              "title": {"type": "string"},
              "reason": {"type": "string"}
            }
          }
        },
        "decisions": {
          "type": "array",
          "items": {
            "$ref": "#/definitions/decision"
          }
        }
      }
    },
    "learnings": {
      "type": "object",
      "description": "Optional session learnings",
      "properties": {
        "patterns": {
          "type": "array",
          "items": {
            "type": "object",
            "properties": {
              "pattern": {"type": "string"},
              "context": {"type": "string"},
              "application": {"type": "string"}
            }
          }
        },
        "avoidances": {
          "type": "array",
          "items": {
            "type": "object",
            "properties": {
              "antipattern": {"type": "string"},
              "consequence": {"type": "string"},
              "correction": {"type": "string"}
            }
          }
        }
      }
    },
    "episodeMetrics": {
      "type": "object",
      "description": "Optional authoritative metrics for episode regeneration when the session commit range includes unrelated history",
      "required": ["filesChanged", "comparison"],
      "additionalProperties": false,
      "properties": {
        "commitHead": {
          "type": "string",
          "pattern": "^[0-9a-f]{7,40}$",
          "description": "Latest commit authored by this session when QA rebinding advances comparison.head"
        },
        "filesChanged": {
          "type": "integer",
          "minimum": 0,
          "description": "Authoritative count of files owned by this session"
        },
        "comparison": {
          "type": "object",
          "required": ["kind", "base", "head"],
          "additionalProperties": false,
          "properties": {
            "kind": {
              "type": "string",
              "enum": ["gitCommitRange", "githubPullRequest"]
            },
            "pullRequest": {
              "type": "integer",
              "minimum": 1
            },
            "base": {
              "type": "string",
              "pattern": "^[0-9a-f]{7,40}$"
            },
            "head": {
              "type": "string",
              "pattern": "^[0-9a-f]{7,40}$"
            }
          }
        }
      }
    },
    "endingCommit": {
      "type": "string",
      "description": "Git commit SHA at session end (empty if no commit)",
      "pattern": "^([0-9a-f]{7,40})?$"
    },
    "nextSteps": {
      "type": "array",
      "description": "Follow-up actions or recommendations",
      "items": {
        "type": "string"
      }
    },
    "developmentPhase": {
      "$ref": "#/definitions/developmentPhase"
    }
  },
  "definitions": {
    "checklistItem": {
      "type": "object",
      "description": "Protocol checklist item with evidence",
      "anyOf": [
        {
          "required": ["Complete", "level", "Evidence"],
          "properties": {
            "Complete": {"type": "boolean"},
            "level": {
              "type": "string",
              "enum": ["MUST", "SHOULD", "MUST NOT"]
            },
            "Evidence": {"type": "string"}
          }
        },
        {
          "required": ["complete", "level", "evidence"],
          "properties": {
            "complete": {"type": "boolean"},
            "level": {
              "type": "string",
              "enum": ["MUST", "SHOULD", "MUST NOT"]
            },
            "evidence": {"type": "string"}
          }
        }
      ]
    },
    "simpleWorkLogEntry": {
      "type": "object",
      "description": "Simple work log entry with action and result",
      "required": ["action"],
      "properties": {
        "action": {
          "type": "string",
          "description": "What was done"
        },
        "result": {
          "type": "string",
          "description": "Outcome or impact"
        },
        "files": {
          "type": "array",
          "description": "Affected file paths",
          "items": {
            "type": "string"
          }
        }
      }
    },
    "deliverable": {
      "type": "object",
      "required": ["type", "path", "description"],
      "properties": {
        "type": {
          "type": "string",
          "description": "Deliverable category",
          "examples": ["analysis", "architecture", "memory", "code", "test"]
        },
        "path": {
          "type": "string",
          "description": "File path"
        },
        "description": {
          "type": "string",
          "description": "What this deliverable provides"
        }
      }
    },
    "decision": {
      "type": "object",
      "required": ["decision", "rationale", "impact"],
      "properties": {
        "decision": {
          "type": "string",
          "description": "What was decided"
        },
        "rationale": {
          "type": "string",
          "description": "Why this decision was made"
        },
        "impact": {
          "type": "string",
          "description": "Expected consequences or effects"
        }
      }
    },
    "developmentPhase": {
      "type": "object",
      "description": "SPARC development phase tracking. See .agents/governance/sparc-methodology.md",
      "required": ["current"],
      "properties": {
        "current": {
          "type": "string",
          "description": "Current development phase",
          "enum": ["specification", "pseudocode", "architecture", "refinement", "completion"]
        },
        "history": {
          "type": "array",
          "description": "Phase transition history",
          "items": {
            "type": "object",
            "required": ["phase"],
            "properties": {
              "phase": {
                "type": "string",
                "enum": ["specification", "pseudocode", "architecture", "refinement", "completion"]
              },
              "gate": {
                "type": "string",
                "enum": ["passed", "failed", "in_progress", "skipped"]
              },
              "timestamp": {
                "type": "string",
                "format": "date-time"
              }
            }
          }
        }
      }
    }
  }
}
