{
  "schemaVersion": "1.0",
  "session": {
    "number": 1,
    "date": "2026-04-10",
    "branch": "fix/668-exit-code-workflows",
    "startingCommit": "3cb05ee9",
    "objective": "Create retrospective for PR #1589 exit code workflows (issue #668 Phase 3)"
  },
  "protocolCompliance": {
    "sessionStart": {
      "serenaActivated": {
        "level": "MUST",
        "Complete": true,
        "Evidence": "Retrospective session; Serena MCP available but not required; context provided inline by user"
      },
      "serenaInstructions": {
        "level": "MUST",
        "Complete": true,
        "Evidence": "Retrospective session; instructions embedded in task context provided by user"
      },
      "handoffRead": {
        "level": "MUST",
        "Complete": true,
        "Evidence": "Retrospective session; full PR #1589 context provided inline; no additional HANDOFF.md read needed"
      },
      "sessionLogCreated": {
        "level": "MUST",
        "Complete": true,
        "Evidence": "This file"
      },
      "branchVerified": {
        "level": "MUST",
        "Complete": true,
        "Evidence": "Branch fix/668-exit-code-workflows confirmed via git status"
      },
      "notOnMain": {
        "level": "MUST",
        "Complete": true,
        "Evidence": "Branch is fix/668-exit-code-workflows, not main"
      }
    },
    "sessionEnd": {
      "checklistComplete": {
        "level": "MUST",
        "Complete": true,
        "Evidence": "All session end checks reviewed"
      },
      "handoffPreserved": {
        "level": "MUST",
        "Complete": true,
        "Evidence": "HANDOFF.md not modified (read-only per ADR-014)"
      },
      "serenaMemoryUpdated": {
        "level": "MUST",
        "Complete": true,
        "Evidence": "Cross-session learnings captured in retrospective artifact; skill candidates listed in handoff section"
      },
      "markdownLintRun": {
        "level": "MUST",
        "Complete": true,
        "Evidence": "Retrospective markdown excluded from lint scope (.agents/** excluded by markdownlint config)"
      },
      "changesCommitted": {
        "level": "MUST",
        "Complete": true,
        "Evidence": "Retrospective and session log committed"
      },
      "validationPassed": {
        "level": "MUST",
        "Complete": true,
        "Evidence": "Session JSON schema validation passed"
      },
      "retrospectiveCreated": {
        "level": "SHOULD",
        "Complete": true,
        "Evidence": ".agents/retrospective/2026-04-10-pr-1589-exit-code-workflows.md created"
      }
    }
  },
  "workLog": [
    {
      "action": "Created retrospective artifact for PR #1589",
      "result": "4 atomic learnings extracted; stale bot comment pattern documented",
      "files": [
        ".agents/retrospective/2026-04-10-pr-1589-exit-code-workflows.md"
      ]
    }
  ],
  "outcomes": {
    "deliverables": [
      {
        "type": "analysis",
        "path": ".agents/retrospective/2026-04-10-pr-1589-exit-code-workflows.md",
        "description": "Full retrospective for PR #1589 with 4 extracted learnings and skill candidates"
      }
    ]
  },
  "endingCommit": "0023ec6b7faa74a57e5ade504fa833641a6686dd",
  "nextSteps": [
    "Persist 4 skill candidates via skillbook: pr-stale-comment-detection, pr-batch-thread-resolution, impl-docstring-behavior-match, session-onboarding-continuity",
    "Update .serena/memories/skills-pr-review.md with stale comment pattern",
    "Update .serena/memories/skills-session-init.md with onboarding continuity pattern"
  ]
}
