{
  "schemaVersion": "1.0.0",
  "session": {
    "branch": "fix/1352-script-path-resolution",
    "number": 1194,
    "startingCommit": "61088a37",
    "objective": "Complete PowerShell-to-Python migration across .claude/ directory per ADR-042",
    "date": "2026-03-01"
  },
  "protocolCompliance": {
    "sessionStart": {
      "notOnMain": {"Complete": true, "Evidence": "Branch: fix/1352-script-path-resolution"},
      "branchVerified": {"Complete": true, "Evidence": "git branch confirmed fix/1352-script-path-resolution"},
      "serenaInstructions": {"Complete": true, "Evidence": "Serena initialized at session start"},
      "sessionLogCreated": {"Complete": true, "Evidence": "Session log created at session start"},
      "serenaActivated": {"Complete": true, "Evidence": "Serena initialized at session start"},
      "handoffRead": {"Complete": true, "Evidence": "HANDOFF.md read for context"},
      "memoriesLoaded": {"Complete": true, "Evidence": "memory-index, skills-powershell-index loaded"}
    },
    "sessionEnd": {
      "checklistComplete": {"Complete": true, "Evidence": "All session end tasks completed"},
      "sessionLogCompleted": {"Complete": true},
      "markdownLintRun": {"Complete": true, "Evidence": "markdownlint-cli2 passed on all staged .md files"},
      "markdownLinted": {"Complete": true, "Evidence": "markdownlint-cli2 passed on all staged .md files"},
      "validationPassed": {"Complete": true, "Evidence": "Session log validated"},
      "handoffPreserved": {"Complete": true, "Evidence": "HANDOFF.md preserved"},
      "serenaMemoryUpdated": {"Complete": true, "Evidence": "Serena memories updated"},
      "changesCommitted": {"Complete": true}
    }
  },
  "workLog": [
    {
      "description": "Delete all PowerShell scripts and modules from .claude/ directory",
      "filesChanged": 47,
      "type": "deletion"
    },
    {
      "description": "Add Python replacement scripts with identical functionality",
      "filesChanged": 43,
      "type": "feature"
    },
    {
      "description": "Add comprehensive test suites for all migrated scripts",
      "filesChanged": 50,
      "type": "test"
    },
    {
      "description": "Update documentation references from PS1 to Python equivalents",
      "filesChanged": 80,
      "type": "documentation"
    },
    {
      "description": "Update .claude/settings.json hook commands from pwsh to python3",
      "filesChanged": 1,
      "type": "configuration"
    },
    {
      "description": "Fix pre-commit hook set-e bug in skill validator command substitution",
      "filesChanged": 1,
      "type": "bugfix"
    }
  ],
  "nextSteps": [
    "Verify CI passes on the push",
    "Address any remaining test failures in CI environment"
  ],
  "endingCommit": "0023ec6b7faa74a57e5ade504fa833641a6686dd"
}
