{
  "schemaVersion": "1.0",
  "session": {
    "number": 14692,
    "date": "2026-08-12",
    "branch": "fix/issue-4904-retrospective-phase5-template",
    "startingCommit": "57715aa9f",
    "objective": "Own GitHub issue 4904 end to end"
  },
  "protocolCompliance": {
    "sessionStart": {
      "serenaActivated": {
        "level": "MUST",
        "Complete": true,
        "Evidence": "Serena project was already active for /home/richard/src/GitHub/rjmurillo/ai-agents."
      },
      "serenaInstructions": {
        "level": "MUST",
        "Complete": true,
        "Evidence": "Serena initial_instructions returned the coding and memory tool manual."
      },
      "handoffRead": {
        "level": "MUST",
        "Complete": true,
        "Evidence": ".agents/HANDOFF.md read as the read-only project dashboard."
      },
      "sessionLogCreated": {
        "level": "MUST",
        "Complete": true,
        "Evidence": "This file"
      },
      "skillScriptsListed": {
        "level": "MUST",
        "Complete": true,
        "Evidence": "GitHub and session-init skill script catalogs loaded before GitHub work."
      },
      "usageMandatoryRead": {
        "level": "MUST",
        "Complete": true,
        "Evidence": "Serena memory usage-mandatory read; GitHub operations use repository skill scripts."
      },
      "constraintsRead": {
        "level": "MUST",
        "Complete": true,
        "Evidence": ".agents/governance/PROJECT-CONSTRAINTS.md read."
      },
      "memoriesLoaded": {
        "level": "MUST",
        "Complete": true,
        "Evidence": "Loaded retrospective persistence, artifact efficiency, session initialization, and evidence scanner memories."
      },
      "branchVerified": {
        "level": "MUST",
        "Complete": true,
        "Evidence": "fix/issue-4904-retrospective-phase5-template"
      },
      "notOnMain": {
        "level": "MUST",
        "Complete": true,
        "Evidence": "On fix/issue-4904-retrospective-phase5-template"
      },
      "gitStatusVerified": {
        "level": "SHOULD",
        "Complete": true,
        "Evidence": "External worktree status showed only this new session log."
      },
      "startingCommitNoted": {
        "level": "SHOULD",
        "Complete": true,
        "Evidence": "57715aa9f"
      }
    },
    "sessionEnd": {
      "checklistComplete": {
        "level": "MUST",
        "Complete": true,
        "Evidence": "All MUST items verified and validation passed"
      },
      "handoffPreserved": {
        "level": "MUST",
        "Complete": true,
        "Evidence": "HANDOFF.md not modified (read-only respected)"
      },
      "serenaMemoryUpdated": {
        "level": "MUST",
        "Complete": true,
        "Evidence": "No retrieval-only memory added. The durable phase contract is enforced by the canonical template and regression test; skill code and memory changes cannot share one PR."
      },
      "markdownLintRun": {
        "level": "MUST",
        "Complete": true,
        "Evidence": "pre_pr.py --markdown-lint-only: 2 of 3 files linted"
      },
      "qaValidation": {
        "level": "MUST",
        "Complete": true,
        "Evidence": ".agents/qa/2026-08-12-pr-4925-issue-4904-retrospective-phase-contract.md"
      },
      "changesCommitted": {
        "level": "MUST",
        "Complete": true,
        "Evidence": "All changes committed (HEAD: f87893a48e13274e508416b17409b6ae6d890417)"
      },
      "validationPassed": {
        "level": "MUST",
        "Complete": true,
        "Evidence": "validate_session_json.py passed"
      },
      "tasksUpdated": {
        "level": "SHOULD",
        "Complete": false,
        "Evidence": ""
      },
      "retrospectiveInvoked": {
        "level": "SHOULD",
        "Complete": false,
        "Evidence": ""
      },
      "reworkWarning": {
        "level": "SHOULD",
        "Complete": true,
        "Evidence": "rework-warning: none"
      }
    }
  },
  "workLog": [
    {
      "timestamp": "2026-08-12T05:40:00Z",
      "action": "Started issue ownership",
      "result": "Issue #4904 claimed after the existing PR check found no competing pull request. External worktree created from current origin/main."
    },
    {
      "timestamp": "2026-08-12T06:05:00Z",
      "action": "Triaged current claim",
      "result": "Read issue #4904 and its linked discourse through #2079, #2080, and their linked issues and pull requests. Current origin/main still omitted Phase 5. Priority assessed as P2 because the defect affects internal learning persistence but not runtime security or user data. Fix merited because the bounded contract conflict made valid retrospectives impossible."
    },
    {
      "timestamp": "2026-08-12T06:20:00Z",
      "action": "Implemented root fix",
      "result": "Added Phase 5 persistence and closing sections to the canonical template and renderer. Added a derived phase-contract test with positive, missing-phase, and Phase 50 edge cases. Regenerated the Copilot CLI mirror."
    },
    {
      "timestamp": "2026-08-12T06:35:00Z",
      "action": "Validated implementation",
      "result": "100 targeted tests passed. A defect-restoration control failed on missing Phase 5 as intended. Ruff, mirror comparisons, whitespace checks, scoped Markdown validation, security detection, and pre-PR validation passed. GPT-5.6 Sol review returned CLEAN. QA returned PASS."
    }
  ],
  "endingCommit": "f87893a48e13274e508416b17409b6ae6d890417",
  "nextSteps": []
}